<?xml version="1.0" encoding="UTF-8" ?>

<xsd:schema xmlns="http://c24.net/schema"
            xmlns:xsd="http://www.w3.org/2001/XMLSchema"
            targetNamespace="http://c24.net/schema"
            elementFormDefault="qualified">

    <xsd:element name="config" type="config" />

    <xsd:complexType name="config">
        <xsd:choice minOccurs="0" maxOccurs="unbounded">
            <xsd:element name="services" type="services" />
            <xsd:element name="parameters" type="parameters"/>
            <xsd:element name="commands" type="commands"/>
            <xsd:element name="forms" type="forms" />
            <xsd:element name="routing" type="routing" />
        </xsd:choice>
    </xsd:complexType>

    <xsd:complexType name="parameters">
        <xsd:choice minOccurs="1" maxOccurs="unbounded">
            <xsd:element name="parameter" type="parameter" />
        </xsd:choice>
        <xsd:attribute name="type" type="parameter_type" />
        <xsd:attribute name="key" type="xsd:string" />
    </xsd:complexType>

    <xsd:complexType name="parameter" mixed="true">
        <xsd:choice minOccurs="0" maxOccurs="unbounded">
            <xsd:element name="parameter" type="parameter" />
        </xsd:choice>
        <xsd:attribute name="type" type="parameter_type" />
        <xsd:attribute name="id" type="xsd:string" />
        <xsd:attribute name="key" type="xsd:string" />
        <xsd:attribute name="on-invalid" type="invalid_sequence" />
    </xsd:complexType>

    <xsd:simpleType name="parameter_type">
        <xsd:restriction base="xsd:string">
            <xsd:enumeration value="collection" />
            <xsd:enumeration value="service" />
            <xsd:enumeration value="string" />
            <xsd:enumeration value="constant" />
        </xsd:restriction>
    </xsd:simpleType>

    <xsd:simpleType name="invalid_sequence">
        <xsd:restriction base="xsd:string">
            <xsd:enumeration value="null" />
            <xsd:enumeration value="ignore" />
            <xsd:enumeration value="exception" />
        </xsd:restriction>
    </xsd:simpleType>

    <xsd:complexType name="routing">
        <xsd:choice minOccurs="0" maxOccurs="unbounded">
            <xsd:element name="file" type="file"/>
        </xsd:choice>
    </xsd:complexType>

    <xsd:complexType name="file">
        <xsd:attribute name="path" type="xsd:string" use="required" />
    </xsd:complexType>

    <xsd:complexType name="commands">
        <xsd:choice minOccurs="0" maxOccurs="unbounded" >
            <xsd:element name="command" type="command"/>
        </xsd:choice>
    </xsd:complexType>

    <xsd:complexType name="command">
        <xsd:attribute name="class" type="xsd:string" use="required" />
    </xsd:complexType>

    <xsd:complexType name="forms">
        <xsd:choice minOccurs="0" maxOccurs="unbounded" >
            <xsd:element name="form" type="form" />
        </xsd:choice>
    </xsd:complexType>

    <xsd:complexType name="form">
        <xsd:attribute name="name" type="xsd:string" use="required" />
        <xsd:attribute name="class" type="xsd:string" use="required" />
    </xsd:complexType>

    <xsd:complexType name="services">
        <xsd:annotation>
            <xsd:documentation><![CDATA[
        Enclosing element for the definition of all services
      ]]></xsd:documentation>
        </xsd:annotation>
        <xsd:choice minOccurs="1" maxOccurs="unbounded">
            <xsd:element name="service" type="service" />
        </xsd:choice>
    </xsd:complexType>

    <xsd:complexType name="service">
        <xsd:choice maxOccurs="unbounded">
            <xsd:element name="file" type="xsd:string" minOccurs="0" maxOccurs="1" />
            <xsd:element name="argument" type="argument" minOccurs="0" maxOccurs="unbounded" />
            <xsd:element name="factory" type="factory" minOccurs="0" maxOccurs="unbounded" />
            <xsd:element name="configurator" type="configurator" minOccurs="0" maxOccurs="1" />
            <xsd:element name="call" type="call" minOccurs="0" maxOccurs="unbounded" />
            <xsd:element name="tag" type="tag" minOccurs="0" maxOccurs="unbounded" />
            <xsd:element name="property" type="property" minOccurs="0" maxOccurs="unbounded" />
        </xsd:choice>
        <xsd:attribute name="id" type="xsd:string" />
        <xsd:attribute name="class" type="xsd:string" />
        <xsd:attribute name="scope" type="xsd:string" />
        <xsd:attribute name="public" type="boolean" />
        <xsd:attribute name="synthetic" type="boolean" />
        <xsd:attribute name="abstract" type="boolean" />
        <xsd:attribute name="factory" type="xsd:string" />
        <xsd:attribute name="alias" type="xsd:string" />
        <xsd:attribute name="parent" type="xsd:string" />
        <xsd:attribute name="shared" type="xsd:boolean" />
    </xsd:complexType>

    <xsd:complexType name="tag">
        <xsd:attribute name="name" type="xsd:string" />
        <xsd:anyAttribute namespace="##any" processContents="lax" />
    </xsd:complexType>

    <xsd:complexType name="property" mixed="true">
        <xsd:choice minOccurs="0" maxOccurs="1">
            <xsd:element name="service" type="service" />
        </xsd:choice>
        <xsd:attribute name="type" type="argument_type" />
        <xsd:attribute name="id" type="xsd:string" />
        <xsd:attribute name="name" type="xsd:string" />
        <xsd:attribute name="on-invalid" type="xsd:string" />
        <xsd:attribute name="strict" type="boolean" />
    </xsd:complexType>

    <xsd:complexType name="argument" mixed="true">
        <xsd:choice maxOccurs="unbounded">
            <xsd:element name="argument" type="argument" minOccurs="0" maxOccurs="unbounded" />
            <xsd:element name="service" type="service" />
        </xsd:choice>
        <xsd:attribute name="type" type="argument_type" />
        <xsd:attribute name="id" type="xsd:string" />
        <xsd:attribute name="key" type="xsd:string" />
        <xsd:attribute name="index" type="xsd:integer" />
        <xsd:attribute name="on-invalid" type="xsd:string" />
        <xsd:attribute name="strict" type="boolean" />
    </xsd:complexType>

    <xsd:complexType name="factory" mixed="true">
        <xsd:attribute name="service" type="xsd:string" />
        <xsd:attribute name="class" type="xsd:string" />
        <xsd:attribute name="method" type="xsd:string" />
    </xsd:complexType>

    <xsd:complexType name="call" mixed="true">
        <xsd:choice maxOccurs="unbounded">
            <xsd:element name="argument" type="argument" minOccurs="0" maxOccurs="unbounded" />
            <xsd:element name="service" type="service" />
        </xsd:choice>
        <xsd:attribute name="method" type="xsd:string" />
    </xsd:complexType>

    <xsd:simpleType name="argument_type">
        <xsd:restriction base="xsd:string">
            <xsd:enumeration value="collection" />
            <xsd:enumeration value="service" />
            <xsd:enumeration value="string" />
            <xsd:enumeration value="constant" />
        </xsd:restriction>
    </xsd:simpleType>

    <xsd:simpleType name="boolean">
        <xsd:restriction base="xsd:string">
            <xsd:pattern value="(%.+%|true|false)" />
        </xsd:restriction>
    </xsd:simpleType>

    <xsd:complexType name="configurator">
        <xsd:attribute name="id" type="xsd:string" />
        <xsd:attribute name="service" type="xsd:string" />
        <xsd:attribute name="class" type="xsd:string" />
        <xsd:attribute name="method" type="xsd:string" />
        <xsd:attribute name="function" type="xsd:string" />
    </xsd:complexType>

</xsd:schema>